{
  "schema": "fidryn.case-record/v0.1",
  "module": "Examples.BryanRevocableTrust@0.1.0",
  "facts": {
    "acting_trustee": "Bryan"
  },
  "evidence": [
    {
      "schema": "OccupancyRecord",
      "value": {
        "person": "Bryan",
        "office": "TrusteeOf(BRT)"
      },
      "observedAt": "2026-08-23T12:00:00Z"
    },
    {
      "schema": "PhysicianCertificate",
      "value": {
        "issuer": "PhysicianOne",
        "subject": "Bryan",
        "purpose": "Administer(BRT)",
        "conclusion": "Supports",
        "examined_at": "2026-08-23T10:00:00Z",
        "signed_at": "2026-08-23T11:00:00Z"
      },
      "observedAt": "2026-08-23T12:00:00Z"
    }
  ],
  "determinations": [],
  "interpretations": {},
  "decisions": {},
  "closures": [
    {
      "domain": "certificates_received",
      "closed": true
    }
  ],
  "outsideScope": [
    "tax",
    "creditor_priority"
  ],
  "admissibleCompletions": {
    "interpretations": {
      "SuccessorEligibility": [
        "I1",
        "I2"
      ]
    },
    "evidence": {
      "SecondConcurringCertificate": {
        "responses": [
          "absent",
          "present_prospective"
        ],
        "effectOnValidTime": "unchanged_if_after_query_valid_time"
      }
    },
    "choices": {}
  }
}
