{
  "schema": "fidryn.case-record/v0.1",
  "module": "US.Federal.Tax.ClosedForms@0.1.0",
  "facts": {
    "entity": {
      "kind": "entity",
      "data": "AcmeLLC"
    },
    "validDate": "2026-09-01",
    "DomesticCompany(AcmeLLC)": true
  },
  "evidence": [
    {
      "schema": "BeneficialOwnershipReport",
      "value": {
        "company": {
          "kind": "entity",
          "data": "AcmeLLC"
        },
        "year": 2026
      },
      "observedAt": "2026-09-01T00:00:00-04:00"
    }
  ],
  "determinations": [],
  "interpretations": {},
  "decisions": {},
  "closures": [
    {
      "domain": "reporting_companies",
      "closed": true
    }
  ],
  "outsideScope": [
    "tax_engines",
    "live_government_filing",
    "complete_IRC",
    "state_tax",
    "international_tax",
    "partnership_allocations",
    "open_textured_credits_except_as_declared"
  ],
  "admissibleCompletions": {
    "interpretations": {},
    "evidence": {},
    "choices": {}
  }
}
