{
  "schema": "fidryn.case-record/v0.1",
  "module": "NewYork.Transparency.FOIL@0.1.0",
  "facts": {
    "start": {
      "kind": "instant",
      "data": "2026-09-14T00:00:00-04:00"
    },
    "as_of": {
      "kind": "instant",
      "data": "2026-09-17T00:00:00-04:00"
    }
  },
  "admissibleCompletions": {}
}
