{
  "schema": "fidryn.case-record/v0.1",
  "module": "US.Federal.FOIA.RequestProcessing@0.1.0",
  "facts": {
    "responsive_record": {
      "parts": [
        {
          "id": "Part17",
          "content": "Draft deliberative memorandum"
        }
      ]
    },
    "proposed_disposition": {
      "released": [],
      "withheld": [
        {
          "part": {
            "id": "Part17",
            "content": "Draft deliberative memorandum"
          },
          "basis": {
            "kind": "ctor",
            "data": {
              "name": "HarmBased",
              "fields": {
                "exemption": {
                  "kind": "ctor",
                  "data": {
                    "name": "Exemption5",
                    "fields": {}
                  }
                },
                "protected_interest": {
                  "kind": "ctor",
                  "data": {
                    "name": "DeliberativeProcessInterest",
                    "fields": {}
                  }
                }
              }
            }
          }
        }
      ]
    },
    "part": {
      "id": "Part17",
      "content": "Draft deliberative memorandum"
    },
    "protected_interest": {
      "kind": "ctor",
      "data": {
        "name": "DeliberativeProcessInterest",
        "fields": {}
      }
    },
    "exemption": {
      "kind": "ctor",
      "data": {
        "name": "Exemption5",
        "fields": {}
      }
    },
    "request": {
      "requester": {
        "kind": "entity",
        "data": "Requester"
      },
      "target_agency": {
        "kind": "entity",
        "data": "Agency"
      },
      "description": "Records concerning the agency decision",
      "requested_format": "text/plain",
      "submitted_at": {
        "kind": "instant",
        "data": "2026-08-23T15:00:00Z"
      }
    }
  },
  "evidence": [
    {
      "schema": "CitedWithholdingBasis",
      "value": "exemption-5-part-17",
      "observedAt": "2026-08-23T12:00:00-04:00"
    }
  ],
  "determinations": [],
  "interpretations": {},
  "decisions": {},
  "closures": [],
  "outsideScope": [
    "proactive_disclosure",
    "fee_waiver_merits",
    "every_exemption_element",
    "ten_day_component_rerouting_rule",
    "time_limit_tolling",
    "unusual_circumstances_extensions",
    "PrivacyAct_interaction",
    "complete_appeal_and_litigation_procedure",
    "non_withholding_adverse_determination_categories",
    "sources_not_listed_in_this_bundle"
  ],
  "admissibleCompletions": {
    "interpretations": {},
    "evidence": {
      "HarmAnalysis": {
        "responses": [
          "absent",
          "present"
        ],
        "effectOnValidTime": "unchanged_if_after_query_valid_time"
      },
      "SegregabilityAnalysis": {
        "responses": [
          "absent",
          "present"
        ],
        "effectOnValidTime": "unchanged_if_after_query_valid_time"
      }
    },
    "choices": {}
  }
}
