{
  "schema": "fidryn.case-record/v0.1",
  "module": "Examples.CivilComplaint@0.1.0",
  "facts": {
    "case": {
      "kind": "entity",
      "data": "DistrictCase"
    },
    "complaint": {
      "kind": "entity",
      "data": "ComplaintPleading"
    },
    "answer": {
      "kind": "entity",
      "data": "AnswerPleading"
    },
    "commenced": true,
    "answered": true
  },
  "evidence": [
    {
      "schema": "Pleading",
      "value": "complaint-1",
      "observedAt": "2026-08-24T09:00:00-04:00"
    },
    {
      "schema": "Pleading",
      "value": "answer-1",
      "observedAt": "2026-09-10T09:00:00-04:00"
    }
  ],
  "determinations": [],
  "interpretations": {},
  "decisions": {},
  "closures": [],
  "outsideScope": [
    "discovery",
    "jury_practice",
    "class_actions",
    "complete_FRCP",
    "appellate_procedure",
    "state_procedure",
    "evidence_code"
  ],
  "admissibleCompletions": {
    "interpretations": {},
    "evidence": {
      "JudgmentEntry": {
        "responses": [
          "absent",
          "present"
        ],
        "effectOnValidTime": "unchanged_if_after_query_valid_time"
      }
    },
    "choices": {}
  }
}
