{
  "schema": "fidryn.case-record/v0.1",
  "module": "Examples.BryanRevocableTrust@0.1.0",
  "facts": {
    "open_alice_branch": true
  },
  "admissibleCompletions": {
    "interpretations": {
      "SuccessorEligibility": [
        "I1",
        "I2"
      ]
    }
  },
  "evidence": [
    {
      "schema": "OccupancyRecord",
      "value": {
        "person": "Bryan",
        "office": "TrusteeOf(BRT)"
      },
      "observedAt": "2026-08-23T12:00:00Z"
    }
  ]
}
