{
  "schema": "fidryn.case-record/v0.1",
  "module": "US.Everyday.FinalPaycheckGuide@0.1.0",
  "facts": {
    "end": {
      "kind": "instant",
      "data": "2026-09-01T00:00:00-04:00"
    },
    "payday": {
      "kind": "instant",
      "data": "2026-09-15T00:00:00-04:00"
    },
    "as_of": {
      "kind": "instant",
      "data": "2026-09-10T00:00:00-04:00"
    }
  },
  "admissibleCompletions": {}
}
