{
  "schema": "fidryn.case-record/v0.1",
  "module": "Examples.CivilComplaint@0.1.0",
  "facts": {
    "case": {
      "kind": "entity",
      "data": "DistrictCase"
    },
    "complaint": {
      "kind": "entity",
      "data": "ComplaintPleading"
    },
    "answer": {
      "kind": "entity",
      "data": "AnswerPleading"
    },
    "judgment_entry": {
      "proceeding": {
        "kind": "entity",
        "data": "DistrictCase"
      },
      "court": {
        "kind": "entity",
        "data": "Forum"
      },
      "entered_at": {
        "kind": "instant",
        "data": "2026-10-01T20:00:00Z"
      },
      "disposition": "Judgment entered for plaintiff",
      "finality": {
        "kind": "ctor",
        "data": {
          "name": "Final",
          "fields": {}
        }
      }
    },
    "commenced": true,
    "answered": true
  },
  "evidence": [
    {
      "schema": "Pleading",
      "value": "complaint-1",
      "observedAt": "2026-08-24T09:00:00-04:00"
    },
    {
      "schema": "Pleading",
      "value": "answer-1",
      "observedAt": "2026-09-10T09:00:00-04:00"
    },
    {
      "schema": "JudgmentEntry",
      "value": {
        "proceeding": {
          "kind": "entity",
          "data": "DistrictCase"
        },
        "court": {
          "kind": "entity",
          "data": "Forum"
        },
        "entered_at": {
          "kind": "instant",
          "data": "2026-10-01T20:00:00Z"
        },
        "disposition": "Judgment entered for plaintiff",
        "finality": {
          "kind": "ctor",
          "data": {
            "name": "Final",
            "fields": {}
          }
        }
      },
      "observedAt": "2026-10-01T16:00:00-04:00"
    }
  ],
  "determinations": [
    {
      "issue": "Adjudicated(DistrictCase)",
      "protocol": "JudgmentOnTheMerits",
      "established": true,
      "decider": "CourtWithJurisdiction"
    }
  ],
  "interpretations": {},
  "decisions": {},
  "closures": [
    {
      "domain": "judgment_entries",
      "closed": true
    }
  ],
  "outsideScope": [
    "discovery",
    "jury_practice",
    "class_actions",
    "complete_FRCP",
    "appellate_procedure",
    "state_procedure",
    "evidence_code"
  ],
  "admissibleCompletions": {
    "interpretations": {},
    "evidence": {},
    "choices": {}
  }
}
