{
  "schema": "fidryn.case-record/v0.1",
  "module": "California.Housing.SecurityDeposit@0.1.0",
  "facts": {
    "end": {
      "kind": "instant",
      "data": "2026-09-01T00:00:00-07:00"
    },
    "as_of": {
      "kind": "instant",
      "data": "2026-09-11T00:00:00-07:00"
    }
  },
  "admissibleCompletions": {}
}
