{
  "schema": "fidryn.case-record/v0.1",
  "module": "California.Privacy.CPRARequest@0.1.0",
  "facts": {
    "start": {
      "kind": "instant",
      "data": "2026-09-01T00:00:00-07:00"
    },
    "as_of": {
      "kind": "instant",
      "data": "2026-09-21T00:00:00-07:00"
    }
  },
  "admissibleCompletions": {}
}
