{
  "schema": "fidryn.case-record/v0.1",
  "module": "US.Federal.Labor.TitleVIIChargeDeadline@0.1.0",
  "facts": {
    "start": {
      "kind": "instant",
      "data": "2026-01-01T00:00:00Z"
    },
    "as_of": {
      "kind": "instant",
      "data": "2026-04-11T00:00:00Z"
    },
    "worksharing": true
  },
  "admissibleCompletions": {}
}
