{
  "schema": "fidryn.case-record/v0.1",
  "module": "US.Federal.Consumer.FCRADispute@0.1.0",
  "facts": {
    "start": {
      "kind": "instant",
      "data": "2026-09-01T00:00:00Z"
    },
    "as_of": {
      "kind": "instant",
      "data": "2026-09-11T00:00:00Z"
    }
  },
  "admissibleCompletions": {}
}
