{
  "schema": "fidryn.case-record/v0.1",
  "module": "US.Federal.Immigration.NaturalizationResidency@0.1.0",
  "facts": {
    "start": {
      "kind": "instant",
      "data": "2021-09-17T00:00:00Z"
    },
    "as_of": {
      "kind": "instant",
      "data": "2026-09-17T00:00:00Z"
    },
    "years": 5
  },
  "admissibleCompletions": {}
}
